"frase","sentimento"
"Estou tão feliz que mal posso me conter!","alegria"
"Essa notícia iluminou o meu dia!","alegria"
"Não acredito que isso realmente aconteceu, estou nas nuvens!","alegria"
"Este é o melhor dia da minha vida.","alegria"
"Estou rindo de orelha a orelha!","alegria"
"Isso me faz sentir tão vivo!","alegria"
"Hoje é um dia maravilhoso!","alegria"
"Estou no topo do mundo!","alegria"
"Esse momento é pura felicidade!","alegria"
"Estou flutuando de alegria!","alegria"
"Isso me assusta muito!","medo"
"Ouvi um barulho estranho no escuro.","medo"
"Estou com um pressentimento ruim sobre isso.","medo"
"Isso é verdadeiramente aterrorizante!","medo"
"Tenho medo do que está por vir.","medo"
"Eu tremo só de pensar nisso.","medo"
"Estou com o coração na mão.","medo"
"Algo não parece certo.","medo"
"Sinto um arrepio na espinha.","medo"
"Isso é de dar calafrios!","medo"
"Que surpresa maravilhosa me encontrar com você!","alegria"
"Meus sonhos estão finalmente se tornando realidade.","alegria"
"Meu coração está dançando de felicidade!","alegria"
"Sinto como se estivesse voando!","alegria"
"Estou tão animado que mal posso esperar!","alegria"
"Eu simplesmente amo momentos assim!","alegria"
"Isso é mágico!","alegria"
"Este presente me fez tão feliz!","alegria"
"Estou tão agradecido por este momento.","alegria"
"Sinto borboletas no estômago de tanta alegria.","alegria"
"A escuridão sempre me deixa nervoso.","medo"
"Essa história me deixou com medo.","medo"
"Não quero ficar sozinho no escuro.","medo"
"Sinto como se alguém estivesse me observando.","medo"
"Este lugar dá arrepios.","medo"
"Eu odeio filmes de terror porque eles me assustam.","medo"
"Essa sombra na parede me deixa desconfortável.","medo"
"Aquela lenda urbana sempre me assusta.","medo"
"Eu temo pelo pior.","medo"
"Algo está espreitando nas sombras.","medo"
"Acordar ao som dos pássaros me traz tanta alegria.","alegria"
"Estou emocionado com a viagem que vamos fazer!","alegria"
"Os primeiros raios de sol sempre me animam.","alegria"
"Receber uma carta sua é motivo de celebração.","alegria"
"Eu sorri o dia todo depois daquela notícia.","alegria"
"A música me levou a um estado de pura euforia.","alegria"
"Estou nas nuvens desde o último final de semana.","alegria"
"Seu abraço sempre me deixa tão contente.","alegria"
"Os fogos de artifício iluminaram meu coração.","alegria"
"Eu sinto uma alegria contagiante no ar!","alegria"
"Eu não quero olhar por baixo da cama; temo o que posso encontrar.","medo"
"O silêncio da casa vazia é ensurdecedor.","medo"
"Ouço passos no corredor quando todos estão dormindo.","medo"
"Os gritos naquela noite me mantêm acordado.","medo"
"Eu temo que algo ruim aconteça se eu for por aquele caminho.","medo"
"Os contos daquela floresta sempre me fizeram evitar o lugar.","medo"
"Esse vulto na janela me fez pular de susto.","medo"
"O canto daquela canção antiga sempre me dá calafrios.","medo"
"Não sei explicar, mas sinto um medo profundo desse lugar.","medo"
"Eu evito olhar para o espelho à meia-noite.","medo"
"Quando você sorri, meu dia se ilumina.","alegria"
"A notícia da sua promoção me deixou extasiado.","alegria"
"Cada risada compartilhada fortalece minha felicidade.","alegria"
"Estou radiante com as possibilidades que estão por vir!","alegria"
"Seu elogio encheu meu coração de alegria.","alegria"
"Eu pulo de entusiasmo só de pensar na nossa viagem.","alegria"
"O cheiro de bolo assando sempre me traz sensações alegres.","alegria"
"É tão bom estar rodeado de amigos e sentir essa alegria contagiante.","alegria"
"O sucesso do meu projeto é pura felicidade.","alegria"
"Essa dança me eleva a um estado de júbilo!","alegria"
"O vento sussurrando à noite me traz desconforto.","medo"
"Estou ansioso sobre o que me espera no escuro.","medo"
"A tempestade iminente parece ameaçadora.","medo"
"Ouvi histórias assustadoras sobre esse velho prédio.","medo"
"Aquele olhar me dá um sentimento de inquietação.","medo"
"Eu sempre temo quando o telefone toca no meio da noite.","medo"
"O barulho estridente me fez estremecer.","medo"
"Aquela rua deserta sempre me deixa apreensivo.","medo"
"O desconhecido é sempre uma fonte de medo para mim.","medo"
"Sinto um frio na barriga sempre que passo por aquele beco.","medo"
"O brilho em seus olhos é pura alegria.","alegria"
"O som da risada das crianças me deixa tão feliz.","alegria"
"Esse clima festivo me faz querer dançar!","alegria"
"Cada novo dia é uma nova chance de ser feliz.","alegria"
"Seu sucesso é uma fonte de alegria para todos nós.","alegria"
"Receber boas notícias me faz sentir onipotente.","alegria"
"O aroma da primavera sempre me traz sensações alegres.","alegria"
"Estou exultante com essa conquista inesperada!","alegria"
"Ver minha família reunida é meu maior prazer.","alegria"
"O entusiasmo contagiante daquele grupo me animou.","alegria"
"Os gritos na floresta fazem meu coração parar.","medo"
"O antigo asilo da cidade tem uma atmosfera assustadora.","medo"
"O filme tinha cenas que me fizeram cobrir os olhos.","medo"
"Sempre sinto um calafrio quando passo pelo cemitério à noite.","medo"
"O relato daquele acidente me deixou horrorizado.","medo"
"Cada rangido da casa vazia intensifica meu medo.","medo"
"A lenda daquele lugar me impede de visitá-lo.","medo"
"Eu sempre temo o pior quando estou sozinho em casa.","medo"
"Esses ruídos inexplicáveis me dão arrepios.","medo"
"O olhar daquela estátua é perturbador.","medo"
"Seu entusiasmo é contagiante e me faz sorrir.","alegria"
"Essa celebração é o ápice da minha felicidade!","alegria"
"Ver o nascer do sol me enche de esperança e alegria.","alegria"
"A expectativa para as férias me deixa eufórico!","alegria"
"Relembrar momentos felizes sempre aquece meu coração.","alegria"
"Estou jubiloso por termos alcançado nossa meta!","alegria"
"Ouvir sua voz é sinônimo de felicidade.","alegria"
"A chegada da primavera me traz grande alegria.","alegria"
"O brilho das estrelas me faz sonhar e sentir alegria.","alegria"
"Estou tão contente que parece que meu coração vai explodir!","alegria"
"O gemido da velha casa me mantém acordado à noite.","medo"
"A ideia de perder você me aterroriza.","medo"
"Aquele antigo conto de fantasmas ainda me assombra.","medo"
"O desconhecido sempre traz uma dose de medo.","medo"
"Sinto um peso no peito quando penso naquele evento traumático.","medo"
"Os pesadelos continuam, e o medo de dormir cresce.","medo"
"Aquele filme de terror me deixou sem dormir por dias.","medo"
"Ouvir um uivo à noite me deixa em alerta.","medo"
"O pensamento de estar sendo seguido me paralisa.","medo"
"O suspense daquele livro me deixou apreensivo.","medo"
"A cada nova conquista, sinto meu coração explodir de alegria.","alegria"
"Os primeiros passos de um bebê sempre me fazem sorrir.","alegria"
"A magia do Natal me faz sentir como uma criança novamente.","alegria"
"O carinho do meu pet quando chego em casa é pura felicidade.","alegria"
"Estou radiante com os resultados positivos do meu trabalho.","alegria"
"Relembrar momentos felizes me dá uma sensação de plenitude.","alegria"
"A celebração do nosso aniversário é um momento de pura alegria.","alegria"
"Sentir o calor do sol na pele é revigorante e alegre.","alegria"
"Receber palavras encorajadoras sempre alegra meu dia.","alegria"
"A esperança de um futuro melhor sempre me enche de alegria.","alegria"
"A solidão daquele velho casarão é apavorante.","medo"
"O rugido distante de um animal desconhecido me deixou em alerta.","medo"
"O relógio soando à meia-noite em uma casa silenciosa é assustador.","medo"
"A ideia de um intruso em casa é aterrorizante.","medo"
"Os rumores sobre desaparecimentos na região me dão calafrios.","medo"
"O cemitério à noite tem uma atmosfera pesada e medonha.","medo"
"Os relâmpagos da tempestade criaram sombras assustadoras.","medo"
"Aqueles olhos vermelhos brilhando na escuridão são petrificantes.","medo"
"O barulho estranho vindo do porão me fez tremer de medo.","medo"
"O eco de um grito em um vale deserto é de arrepiar.","medo"
"A notícia do nascimento me deixou exultante.","alegria"
"Cantar junto com a multidão foi um momento de pura alegria.","alegria"
"Receber reconhecimento pelo meu trabalho me faz tão feliz!","alegria"
"Aquela surpresa preparada pelos meus amigos aqueceu meu coração.","alegria"
"O reencontro com a família sempre traz alegria incontida.","alegria"
"A sensação ao marcar uma viagem é sempre de entusiasmo.","alegria"
"Ver a alegria no rosto de uma criança é inestimável.","alegria"
"O aroma do meu prato favorito sempre me traz felicidade.","alegria"
"O feedback positivo foi um impulso de alegria.","alegria"
"Ouvir a risada contagiante dela é a melhor parte do meu dia.","alegria"
"A escuridão daquela caverna é opressora e assustadora.","medo"
"O silêncio absoluto da floresta à noite é inquietante.","medo"
"A ideia de perder meus entes queridos é meu maior medo.","medo"
"Os gritos na noite foram suficientes para me manter acordado.","medo"
"A perspectiva de falhar me deixa paralisado de medo.","medo"
"A lenda urbana daquela rua sempre me deu arrepios.","medo"
"O canto distante e melancólico daquela canção é assustador.","medo"
"Ser o último a sair do escritório à noite me causa uma sensação estranha.","medo"
"A sombra inesperada na janela me fez pular de susto.","medo"
"Ouvir passos quando se está sozinho é realmente assustador.","medo"
"O carnaval me faz dançar de alegria.","alegria"
"O nascimento de um novo projeto me deixa radiante.","alegria"
"Ver os fogos de artifício é um espetáculo de pura alegria.","alegria"
"Estou tão animado para o fim de semana quanto uma criança com doces.","alegria"
"O aroma da primavera traz uma sensação de renovação e alegria.","alegria"
"A vitória após tanto esforço foi um alívio e alegria simultâneos.","alegria"
"O abraço de um amigo distante trouxe alegria imediata.","alegria"
"A descoberta de um novo hobby me deixou entusiasmado.","alegria"
"Ver meu filho crescer e prosperar é minha maior fonte de alegria.","alegria"
"O elogio do meu chefe foi um sopro de alegria no meu dia.","alegria"
"O barulho de algo arrastando-se no sótão é de gelar o sangue.","medo"
"A menção daquela lenda antiga sempre causa calafrios.","medo"
"Os gritos vindos da casa abandonada são perturbadores.","medo"
"O tremor súbito na tranquilidade da noite me causou pânico.","medo"
"A descrição daquele crime me fez olhar por cima do ombro.","medo"
"O olhar vazio e frio daquela estátua é de assustar qualquer um.","medo"
"A ideia de um apocalipse zumbi sempre me manteve à beira do medo.","medo"
"O som desconhecido no meio do nevoeiro foi aterrorizante.","medo"
"Os relatos de alienígenas sempre me fizeram questionar e temer o desconhecido.","medo"
"Aquela estrada deserta tem histórias que evoco medo em todos.","medo"
"A realização do meu sonho é um sentimento de pura euforia.","alegria"
"Conhecer novas culturas e lugares sempre me preenche de alegria.","alegria"
"Ser reconhecido pelo que amo fazer é indescritível.","alegria"
"O nascer do sol após um dia difícil traz esperança e alegria.","alegria"
"Sentir a brisa do mar sempre rejuvenesce minha alma e traz alegria.","alegria"
"Ver a superação de alguém que amo é uma sensação incrivelmente alegre.","alegria"
"A chegada da primavera e suas cores sempre anima meu espírito.","alegria"
"A celebração de mais um ano de vida é um momento de pura gratidão e alegria.","alegria"
"O primeiro voo de uma ave é um espetáculo de alegria e liberdade.","alegria"
"A energia de um show ao vivo é contagiante e me enche de alegria.","alegria"
"O antigo hospital abandonado tem uma atmosfera de medo palpável.","medo"
"A sensação de ser perseguido em um sonho é absolutamente aterrorizante.","medo"
"A trilha sonora daquele filme de terror ainda ecoa em minha mente.","medo"
"A antiga prisão da cidade é famosa por suas histórias horripilantes.","medo"
"A lenda da mulher de branco sempre me fez evitar aquela estrada à noite.","medo"
"A ideia de estar sozinho em um apocalipse é uma das mais temíveis.","medo"
"Ouvir um lamento no meio da noite em um acampamento é apavorante.","medo"
"Aquelas marcas estranhas na parede me dão uma sensação ruim.","medo"
"Os segredos daquela casa velha são envoltos em medo e mistério.","medo"
"O desconhecido sempre carrega uma aura de medo e respeito.","medo"